{
  "id": "dolly-12b",
  "name": "Databricks Dolly 12B",
  "description": "Databricks' instruction-following model based on Pythia-12B and fine-tuned on a human-generated instruction dataset for commercial use",
  "parameters": 12000000000,
  "precision": "fp16",
  "architecture": {
    "layers": 36,
    "hiddenSize": 5120,
    "attentionHeads": 40,
    "vocabularySize": 50254,
    "maxSequenceLength": 2048
  },
  "vramRequirements": {
    "baseVRAM": 24000,
    "kvCacheCoefficient": 1.2,
    "activationMultiplier": 1.5,
    "overheadFactor": 1.16
  },
  "performance": [
    {
      "gpuType": "H100",
      "tokensPerSecond": 210,
      "batchSize": 8,
      "powerConsumption": 570
    },
    {
      "gpuType": "A100",
      "tokensPerSecond": 115,
      "batchSize": 4,
      "powerConsumption": 380
    },
    {
      "gpuType": "RTX 4090",
      "tokensPerSecond": 50,
      "batchSize": 2,
      "powerConsumption": 380
    },
    {
      "gpuType": "RTX 3090",
      "tokensPerSecond": 34,
      "batchSize": 1,
      "powerConsumption": 350
    }
  ],
  "metadata": {
    "releaseDate": "2023-04-12",
    "organization": "Databricks",
    "license": "Creative Commons",
    "tags": ["instruction-following", "commercial", "open-source", "fine-tuned"],
    "benchmarks": [
      {
        "name": "MMLU",
        "score": 38.2,
        "unit": "accuracy"
      },
      {
        "name": "HumanEval",
        "score": 22.6,
        "unit": "accuracy"
      },
      {
        "name": "GSM8K",
        "score": 15.8,
        "unit": "accuracy"
      },
      {
        "name": "HellaSwag",
        "score": 74.5,
        "unit": "accuracy"
      }
    ]
  }
}