{
  "id": "vicuna-13b",
  "name": "Vicuna 13B",
  "description": "UC Berkeley's fine-tuned LLaMA model trained on user-shared conversations from ShareGPT, achieving GPT-4 level performance on many tasks",
  "parameters": 13000000000,
  "precision": "fp16",
  "architecture": {
    "layers": 40,
    "hiddenSize": 5120,
    "attentionHeads": 40,
    "vocabularySize": 32000,
    "maxSequenceLength": 2048
  },
  "vramRequirements": {
    "baseVRAM": 26000,
    "kvCacheCoefficient": 1.2,
    "activationMultiplier": 1.5,
    "overheadFactor": 1.16
  },
  "performance": [
    {
      "gpuType": "H100",
      "tokensPerSecond": 200,
      "batchSize": 8,
      "powerConsumption": 580
    },
    {
      "gpuType": "A100",
      "tokensPerSecond": 110,
      "batchSize": 4,
      "powerConsumption": 380
    },
    {
      "gpuType": "RTX 4090",
      "tokensPerSecond": 48,
      "batchSize": 2,
      "powerConsumption": 370
    },
    {
      "gpuType": "RTX 3090",
      "tokensPerSecond": 32,
      "batchSize": 1,
      "powerConsumption": 340
    }
  ],
  "metadata": {
    "releaseDate": "2023-03-30",
    "organization": "UC Berkeley",
    "license": "Non-commercial",
    "tags": ["chat", "instruction-following", "fine-tuned", "research"],
    "benchmarks": [
      {
        "name": "MMLU",
        "score": 52.1,
        "unit": "accuracy"
      },
      {
        "name": "HumanEval",
        "score": 26.4,
        "unit": "accuracy"
      },
      {
        "name": "GSM8K",
        "score": 27.6,
        "unit": "accuracy"
      },
      {
        "name": "HellaSwag",
        "score": 82.1,
        "unit": "accuracy"
      }
    ]
  }
}